[
    {
        "id": "runtime-001",
        "timestamp": "2026-07-15T07:37:32.333Z",
        "actor": "Local SentinelOS Executive Desk",
        "action": "outcome status",
        "decision": "executed",
        "gate": "runtime-generated",
        "previousSignature": "GENESIS",
        "signature": "cbfbc7353174ed32e3b260aa6baff45fa67ab029a54f8b8ac820a346bb8b62ed"
    },
    {
        "id": "runtime-002",
        "timestamp": "2026-07-15T07:38:45.672Z",
        "actor": "Local SentinelOS Executive Desk",
        "action": "outcome status",
        "decision": "executed",
        "gate": "runtime-generated",
        "previousSignature": "cbfbc7353174ed32e3b260aa6baff45fa67ab029a54f8b8ac820a346bb8b62ed",
        "signature": "3ebe05462a3e76abff8118a5e2a3790dd8c9dcef040217b58003c9a3a1f97b39"
    },
    {
        "id": "runtime-003",
        "timestamp": "2026-07-15T07:38:49.641Z",
        "actor": "Local SentinelOS Executive Desk",
        "action": "executive weekly",
        "decision": "executed",
        "gate": "runtime-generated",
        "previousSignature": "3ebe05462a3e76abff8118a5e2a3790dd8c9dcef040217b58003c9a3a1f97b39",
        "signature": "d2f6a188b82eac52126a18b76748f18e0fa755d3e6a1a43b9e874753209057c0"
    },
    {
        "id": "runtime-004",
        "timestamp": "2026-07-18T04:15:39.990Z",
        "actor": "Local SentinelOS Executive Desk",
        "action": "health",
        "decision": "executed",
        "gate": "runtime-generated",
        "previousSignature": "d2f6a188b82eac52126a18b76748f18e0fa755d3e6a1a43b9e874753209057c0",
        "signature": "78fc26693762793572c3db3881c2079a95b60eb5daecbdee83787aad0f76a6ef"
    },
    {
        "id": "runtime-005",
        "timestamp": "2026-07-18T04:15:43.278Z",
        "actor": "Local SentinelOS Executive Desk",
        "action": "executive daily",
        "decision": "executed",
        "gate": "runtime-generated",
        "previousSignature": "78fc26693762793572c3db3881c2079a95b60eb5daecbdee83787aad0f76a6ef",
        "signature": "f9e79845bb83c75997edf1b3d23c3e037445cc29c869f4235bda637dfced4299"
    },
    {
        "id": "runtime-006",
        "timestamp": "2026-07-18T04:22:19.296Z",
        "actor": "Local SentinelOS Executive Desk",
        "action": "government readiness",
        "decision": "executed",
        "gate": "runtime-generated",
        "previousSignature": "f9e79845bb83c75997edf1b3d23c3e037445cc29c869f4235bda637dfced4299",
        "signature": "363d387e10ab8cd468bf360eb79e72e94f1c932abf30850e88ecf50ce8dd9ad6"
    },
    {
        "id": "runtime-007",
        "timestamp": "2026-07-18T04:22:22.117Z",
        "actor": "Local SentinelOS Executive Desk",
        "action": "executive weekly",
        "decision": "executed",
        "gate": "runtime-generated",
        "previousSignature": "363d387e10ab8cd468bf360eb79e72e94f1c932abf30850e88ecf50ce8dd9ad6",
        "signature": "b51465d14e887a62d429015585b9b1a928b14d85f6f2f5ed4bd96e2f8cb2251a"
    },
    {
        "id": "runtime-008",
        "timestamp": "2026-07-18T04:22:25.139Z",
        "actor": "Local SentinelOS Executive Desk",
        "action": "executive daily",
        "decision": "executed",
        "gate": "runtime-generated",
        "previousSignature": "b51465d14e887a62d429015585b9b1a928b14d85f6f2f5ed4bd96e2f8cb2251a",
        "signature": "1cba766acd193467466da0e98c3b144c66a2799e30fbe7a6ed7a9e604cfe1905"
    }
]